{
  "bundle_id": "composite::ops/function/math_func.py::fmax",
  "bundle_type": "unit",
  "schema_version": "v2",
  "generated_at": "2026-04-20T20:43:39+08:00",
  "unit": {
    "unit_id": "composite::ops/function/math_func.py::fmax",
    "unit_name": "fmax",
    "unit_type": "composite",
    "impl_path": "mindspore/python/mindspore/ops/function/math_func.py",
    "impl_symbol": "fmax"
  },
  "entries": [
    "mindspore.Tensor.fmax",
    "mindspore.ops.fmax"
  ],
  "components": []
}
