{
  "bundle_id": "branch::hsigmoid_grad_op.yaml::HSigmoidGrad",
  "bundle_type": "unit",
  "schema_version": "v2",
  "generated_at": "2026-04-20T20:43:39+08:00",
  "unit": {
    "unit_id": "branch::hsigmoid_grad_op.yaml::HSigmoidGrad",
    "unit_name": "HSigmoidGrad",
    "unit_type": "branch",
    "op": "hsigmoid_grad",
    "primitive": "HSigmoidGrad",
    "yaml_path": "mindspore/ops/op_def/yaml/hsigmoid_grad_op.yaml",
    "coverage": {
      "aclnn": [
        "aclnnHardsigmoidBackward"
      ],
      "infer": true,
      "kbk": true,
      "pyboost": true,
      "bprop": false,
      "bprop_units": []
    }
  },
  "entries": []
}
