{
  "bundle_id": "branch::cholesky_op.yaml::Cholesky",
  "bundle_type": "unit",
  "schema_version": "v2",
  "generated_at": "2026-04-20T20:43:39+08:00",
  "unit": {
    "unit_id": "branch::cholesky_op.yaml::Cholesky",
    "unit_name": "Cholesky",
    "unit_type": "branch",
    "op": "cholesky",
    "primitive": "Cholesky",
    "yaml_path": "mindspore/ops/op_def/yaml/cholesky_op.yaml",
    "coverage": {
      "aclnn": [],
      "infer": true,
      "kbk": false,
      "pyboost": false,
      "bprop": true,
      "bprop_units": [
        "CholeskyGrad"
      ]
    }
  },
  "entries": [
    "mindspore.ops.cholesky"
  ]
}
