{
  "bundle_id": "branch::reduce_any_op.yaml::ReduceAny",
  "bundle_type": "unit",
  "schema_version": "v2",
  "generated_at": "2026-04-20T20:43:39+08:00",
  "unit": {
    "unit_id": "branch::reduce_any_op.yaml::ReduceAny",
    "unit_name": "ReduceAny",
    "unit_type": "branch",
    "op": "reduce_any",
    "primitive": "ReduceAny",
    "yaml_path": "mindspore/ops/op_def/yaml/reduce_any_op.yaml",
    "coverage": {
      "aclnn": [
        "aclnnAny"
      ],
      "infer": true,
      "kbk": true,
      "pyboost": true,
      "bprop": true,
      "bprop_units": []
    }
  },
  "entries": []
}
