{
  "bundle_id": "branch::get_data_op.yaml::GetData",
  "bundle_type": "unit",
  "schema_version": "v2",
  "generated_at": "2026-04-20T20:43:39+08:00",
  "unit": {
    "unit_id": "branch::get_data_op.yaml::GetData",
    "unit_name": "GetData",
    "unit_type": "branch",
    "op": "get_data",
    "primitive": "GetData",
    "yaml_path": "mindspore/ops/op_def/yaml/get_data_op.yaml",
    "coverage": {
      "aclnn": [
        "aclnnGetData"
      ],
      "infer": true,
      "kbk": true,
      "pyboost": true,
      "bprop": true,
      "bprop_units": []
    }
  },
  "entries": []
}
