{
  "bundle_id": "composite::ops/function/sparse_func.py::csr_reduce_sum",
  "bundle_type": "unit",
  "schema_version": "v2",
  "generated_at": "2026-04-20T20:43:39+08:00",
  "unit": {
    "unit_id": "composite::ops/function/sparse_func.py::csr_reduce_sum",
    "unit_name": "csr_reduce_sum",
    "unit_type": "composite",
    "impl_path": "mindspore/python/mindspore/ops/function/sparse_func.py",
    "impl_symbol": "csr_reduce_sum"
  },
  "entries": [
    "mindspore.ops.csr_reduce_sum"
  ],
  "components": []
}
