{
  "bundle_id": "branch::gather_op.yaml::Gather",
  "bundle_type": "unit",
  "schema_version": "v2",
  "generated_at": "2026-04-20T20:43:39+08:00",
  "unit": {
    "unit_id": "branch::gather_op.yaml::Gather",
    "unit_name": "Gather",
    "unit_type": "branch",
    "op": "gather",
    "primitive": "Gather",
    "yaml_path": "mindspore/ops/op_def/yaml/gather_op.yaml",
    "coverage": {
      "aclnn": [],
      "infer": true,
      "kbk": false,
      "pyboost": false,
      "bprop": true,
      "bprop_units": []
    }
  },
  "entries": []
}
