{
  "bundle_id": "composite::ops/function/sparse_func.py::promote_csr",
  "bundle_type": "unit",
  "schema_version": "v2",
  "generated_at": "2026-04-20T20:43:39+08:00",
  "unit": {
    "unit_id": "composite::ops/function/sparse_func.py::promote_csr",
    "unit_name": "promote_csr",
    "unit_type": "composite",
    "impl_path": "mindspore/python/mindspore/ops/function/sparse_func.py",
    "impl_symbol": "promote_csr"
  },
  "entries": [],
  "components": []
}
