{
  "bundle_id": "branch::maximum_grad_grad_op.yaml::MaximumGradGrad",
  "bundle_type": "unit",
  "schema_version": "v2",
  "generated_at": "2026-04-20T20:43:39+08:00",
  "unit": {
    "unit_id": "branch::maximum_grad_grad_op.yaml::MaximumGradGrad",
    "unit_name": "MaximumGradGrad",
    "unit_type": "branch",
    "op": "maximum_grad_grad",
    "primitive": "MaximumGradGrad",
    "yaml_path": "mindspore/ops/op_def/yaml/maximum_grad_grad_op.yaml",
    "coverage": {
      "aclnn": [],
      "infer": true,
      "kbk": false,
      "pyboost": false,
      "bprop": false,
      "bprop_units": []
    }
  },
  "entries": []
}
