{
  "bundle_id": "branch::assign_add_op.yaml::AssignAdd",
  "bundle_type": "unit",
  "schema_version": "v2",
  "generated_at": "2026-04-20T20:43:39+08:00",
  "unit": {
    "unit_id": "branch::assign_add_op.yaml::AssignAdd",
    "unit_name": "AssignAdd",
    "unit_type": "branch",
    "op": "assign_add",
    "primitive": "AssignAdd",
    "yaml_path": "mindspore/ops/op_def/yaml/assign_add_op.yaml",
    "coverage": {
      "aclnn": [],
      "infer": true,
      "kbk": false,
      "pyboost": false,
      "bprop": true,
      "bprop_units": []
    }
  },
  "entries": [
    "mindspore.ops.assign_add"
  ]
}
