{
  "bundle_id": "composite::ops/function/nn_func.py::mirror_pad",
  "bundle_type": "unit",
  "schema_version": "v2",
  "generated_at": "2026-04-20T20:43:39+08:00",
  "unit": {
    "unit_id": "composite::ops/function/nn_func.py::mirror_pad",
    "unit_name": "mirror_pad",
    "unit_type": "composite",
    "impl_path": "mindspore/python/mindspore/ops/function/nn_func.py",
    "impl_symbol": "mirror_pad"
  },
  "entries": [
    "mindspore.ops.mirror_pad"
  ],
  "components": []
}
